Company;Position;Link;Location;Type;Posted
Clariteia;Senior Python Engineer;https://www.python.org/jobs/4643/;Madrid, Madrid, Spain;Back end, Database, Lead, blockchain;16 June 2020
Backtracks.fm;Senior Python Developer;https://www.python.org/jobs/4642/;Anywhere, Worldwide;Back end, Big Data, Database, Front end, Lead, Operations, Systems, Text Processing, Web;15 June 2020
Reef Technologies;Senior Python Developer, 6h/day, remote;https://www.python.org/jobs/4638/;Remote, Poland;Back end;13 June 2020
P2 Solutions Group;Machine Learning Engineer;https://www.python.org/jobs/4637/;Remote, Remote, USA;Image Processing, Machine Learning, Testing, Python TensorFlow Pytorch Caffe ONXX Keras Java Scala C/C++ API Apache Hive Pig HBase an;12 June 2020
Bitstocks;PhD Computer Scientist;https://www.python.org/jobs/4636/;Chamonix, France;Big Data, Cloud, Database, Finance, Machine Learning, Management, Numeric processing, Operations, Testing, Web;09 June 2020
RCE Staffing;Python Developer in the Hague;https://www.python.org/jobs/4635/;The Hague, The Netherlands;Back end, Database, Systems, Testing;09 June 2020
6nomads;Senior Python Engineer;https://www.python.org/jobs/4634/;Remote, Remote;Back end;08 June 2020
AIsoft Development LLC;Remote Contractor Senior Django REST Developer;https://www.python.org/jobs/4633/;Washington, D.C., D.C., USA;Back end, Cloud, Database, Systems;08 June 2020
Expertus Technologies;Full Stack AWS Python Developper;https://www.python.org/jobs/4632/;Montreal, Quebec, Canada;Back end, Cloud, Finance, Front end, Systems;04 June 2020
Navenio;Full-Stack Developer – R&D;https://www.python.org/jobs/4631/;Oxford, Oxfordshire, UK;Back end, Cloud, Front end, Machine Learning, Systems, Python;04 June 2020
BOTmantra;Python Full Stack developer;https://www.python.org/jobs/4630/;Bangalore, Karnataka, India;Python Django Flask Selenium Nodejs Reactjs;03 June 2020
Wagestream;Python Developer;https://www.python.org/jobs/4629/;London/ Remote, United Kingdom;Back end, Finance;03 June 2020
FELFEL;PYTHON TOOLING DEVELOPER FOR FAST GROWING FOOD START-UP;https://www.python.org/jobs/4628/;Zürich, Zurich, Switzerland;Back end;03 June 2020
Bink;Senior Python Developer;https://www.python.org/jobs/4627/;London/ Remote, United Kingdom;Back end, Finance, Django Postgres;03 June 2020
FELFEL;SENIOR BACK-END DEVELOPER (PYTHON);https://www.python.org/jobs/4626/;Zürich, Zurich, Switzerland;Back end;03 June 2020
FELFEL;PYTHON ENGINEER;https://www.python.org/jobs/4625/;Zürich, Zürich, Switzerland;Back end, Machine Learning, Python;03 June 2020
FELFEL;SENIOR PYTHON SOFTWARE ENGINEER;https://www.python.org/jobs/4623/;Zürich, Zurich, Switzerland;Back end;03 June 2020
FELFEL AG;SENIOR PYTHON DEVELOPER;https://www.python.org/jobs/4621/;Zürich, Zürich, Switzerland;Back end, Machine Learning, Python;03 June 2020
FELFEL;SENIOR SOFTWARE ENGINEER (PYTHON);https://www.python.org/jobs/4620/;Zürich, Zurich, Switzerland;Back end;03 June 2020
Ustechsolutions;Python Developer;https://www.python.org/jobs/4619/;st louis, missouri, USA;Back end, Cloud, REST APIs microservices;02 June 2020
Progressive Insurance;Data Scientist Senior or Lead;https://www.python.org/jobs/4617/;Mayfield Village, Ohio, United States;Big Data, Cloud, Machine Learning, Numeric processing, Text Processing;02 June 2020
Toughbyte;Python Developer;https://www.python.org/jobs/4616/;Oslo, Norway;Back end, Cloud, Operations, Python Go Java Kubernetes Docker AWS Kafka IoT;02 June 2020
Toughbyte;Senior Python Developer;https://www.python.org/jobs/4615/;Helsinki, Finland;Back end, Cloud, Operations, Linux C/C++ Go DevOps;02 June 2020
HAL24K;Senior Python Developer;https://www.python.org/jobs/4614/;Amsterdam, NH, The Netherlands;Back end, Big Data, Cloud, Database, Integration, Machine Learning;01 June 2020
AciesInd Pvt Ltd;Hiring Python Developers;https://www.python.org/jobs/4613/;Chennai, Tamil Nadu, India;Back end, Front end, Web, Django  Flask;31 May 2020
Botcrypto;Software Engineer;https://www.python.org/jobs/4612/;Full remote, Full remote, Full remote;Back end, Finance, Testing, Docker;30 May 2020
Onsharp;Senior Python Developer;https://www.python.org/jobs/4611/;Fargo, ND, United States;Back end, Cloud, Database, Front end, Integration, Testing, Web;29 May 2020
FELFEL;Senior Software Developer C .Net;https://www.python.org/jobs/4610/;Zürich, Switzerland;C# .NET;29 May 2020
FELFEL;Senior Backend Software Engineer (Python);https://www.python.org/jobs/4609/;Zürich, Zürich, Switzerland;Back end, Machine Learning;29 May 2020
Truveris;Senior Software Engineer;https://www.python.org/jobs/4608/;NYC, NY, USA;Back end, Cloud, Database, Web, Python Pylons Pyramid SQLAlchemy React.js Postgresql Linux AWS;28 May 2020
Cross Border Talents;Python Software Engineer;https://www.python.org/jobs/4606/;Eindhoven, North Brabant, Netherlands;Big Data, Image Processing, Machine Learning, Numeric processing, Operations;24 May 2020
Ometria;Senior Software Engineer - (Back-End);https://www.python.org/jobs/4605/;London, United Kingdom;Back end;21 May 2020
Ometria;Senior Software Engineer (Back-End) - Remote;https://www.python.org/jobs/4604/;Remote, United Kingdom;Back end;21 May 2020
Intel 471;Senior Python Engineer (remotely);https://www.python.org/jobs/4603/;Kyiv, Ukraine;Web, Twisted  asyncio Tornado NoSQL SQL AWS;21 May 2020
Scrapinghub;Customer Support Engineer (with Python);https://www.python.org/jobs/4602/;Remote, Remote, Fully remote;Big Data, Cloud, Systems, Web, Python linux HTML Javascript APIs REST JSON Mysql;20 May 2020
Toughbyte;Python+React remote opportunity;https://www.python.org/jobs/4601/;San Francisco, California, United States;Back end, Front end, PythonDjango React;20 May 2020
Gorgias;Full-Stack Engineer;https://www.python.org/jobs/4600/;Remote, Europe;Back end, Front end, Lead;18 May 2020
6nomads;Senior Python Engineer;https://www.python.org/jobs/4595/;Remote, Remote;Back end;14 May 2020
Stack Builders;Experienced Full-Stack Python Developer (Remote - Full Time);https://www.python.org/jobs/4594/;Remote, Remote, Remote;Back end, Database, Front end, Testing, Web, Python - Flask - JavaScript - React.js - Vue.js - CSS;12 May 2020
Stream.io;Backend Software Engineer;https://www.python.org/jobs/4589/;Amsterdam, The Netherlands;Back end, Database, AWS Golang;11 May 2020
Red Hat;Senior Software Engineer - CI/CD;https://www.python.org/jobs/4588/;Westford, MA, USA;Cloud, Integration, Management, Systems;11 May 2020
Red Hat;Principal Software Engineer - Red Hat Storage Solutions;https://www.python.org/jobs/4587/;Remote, United States;Containers Storage;11 May 2020
Red Hat;Software Engineer - Python;https://www.python.org/jobs/4586/;Raleigh, NC, USA;Cloud, Management;11 May 2020
TranQuant;3D Face Image manipulation Tool: Python, The Insight Toolkit (ITK) Specialist - (Remote Position);https://www.python.org/jobs/4585/;Toronto, Ontario, Canada;Back end, Database, Front end, Image Processing, Integration, Machine Learning, Numeric processing, Systems, Testing, Web, numpyscipy;07 May 2020
Rivian;Senior Software Engineer - Core Services;https://www.python.org/jobs/4584/;Palo Alto, California, United States;Back end, Python Lambda DynamoDB;06 May 2020
nineDots;Senior Python Engineer;https://www.python.org/jobs/4550/;Dublin / Remote (EU timezone), Ireland;Back end, Big Data, Database, Systems, Web;05 May 2020
Reef Technologies;Senior Python Developer, 6h/day, remote;https://www.python.org/jobs/4548/;Remote, Poland;Back end;04 May 2020
SIMPETUS;Python Software Engineer;https://www.python.org/jobs/4547/;San Francisco, CA, USA;Testing;01 May 2020
Payatu Security Consulting Pvt. Ltd.;Full Stack Developer;https://www.python.org/jobs/4546/;pune, Maharashtra, India;Web;29.apr.20
ActiveState Software, Inc;Build and Release Engineer;https://www.python.org/jobs/4545/;Vancouver, BC, Canada;;28.apr.20
ActiveState Software, Inc;Senior Engineer - Developer Tooling;https://www.python.org/jobs/4544/;Vancouver, BC, Canada;;28.apr.20
ActiveState Software, Inc;Python Language Specialist - Build Engineer;https://www.python.org/jobs/4543/;Vancouver, BC, Canada;;28.apr.20
UNIOSO s.r.o.;Python developer;https://www.python.org/jobs/4542/;Pilsen, Czech Republic, Czech Republic;Back end, Database, Web, OS Linux PostreSQL Git;27.apr.20
Enable AI;Python Deep Learning Instructur (Keras, TensorFlow) - Germany;https://www.python.org/jobs/4541/;German cities, Germany;Machine Learning, Deep Learning;24.apr.20
Nico Consultancy;Python (Django Framework) developer;https://www.python.org/jobs/4540/;Havant or London, Hampshire, United Kingdom;Back end, Database, Ubuntu OS;24.apr.20
Core Tech Recruitment;Python Django Developer £50k - £65k;https://www.python.org/jobs/4536/;London, Shoreditch, United Kingdom;Back end, Cloud;22.apr.20
Pivot Bio;Data Engineer, R&D;https://www.python.org/jobs/4533/;Berkeley, CA, United States;Back end, Cloud, Database, Front end, Integration, Systems, Testing, Web;20.apr.20
Replicon;Python Developer;https://www.python.org/jobs/4532/;Bengaluru, Karnataka, India;Front end, Django;17.apr.20
Reef Technologies;Senior Python Developer, 6h/day, remote;https://www.python.org/jobs/4531/;Remote, Poland;Back end;17.apr.20
The Interface Financial Group;Software Engineer;https://www.python.org/jobs/4530/;Bethesda, MD, USA;Back end, Python APIs JSON PostgresSQL;16.apr.20
Smart3D;UI Python Developer for 3D Printing equipment;https://www.python.org/jobs/4529/;Buenos Aires, Argentina;Back end, Cloud, Database, Front end, Integration, Systems, Testing;16.apr.20
Smart3D;UI Python Developer for 3D Printing equipment;https://www.python.org/jobs/4528/;Buenos Aires, ARGENTINA;Back end, Cloud, Database, Integration, Testing;16.apr.20
Sentry (sentry.io);Technical Support Specialist (Level 2);https://www.python.org/jobs/4527/;Vienna, Austria;;16.apr.20
Sentry (sentry.io);Senior Web Designer;https://www.python.org/jobs/4526/;San Francisco, CA, United States;;16.apr.20
Sentry (sentry.io);Solutions Engineer;https://www.python.org/jobs/4525/;San Francisco, CA, United States;;16.apr.20
Sentry (sentry.io);Senior Software Engineer, Search & Storage;https://www.python.org/jobs/4524/;San Francisco, CA, United States;;16.apr.20
Sentry (sentry.io);Senior Operations Engineer;https://www.python.org/jobs/4523/;San Francisco, CA, United States;;16.apr.20
Sentry (sentry.io);Senior Frontend Engineer, Workflow;https://www.python.org/jobs/4522/;San Francisco, CA, USA;;16.apr.20
Sentry (sentry.io);Senior Frontend Engineer, Visibility;https://www.python.org/jobs/4521/;Toronto, Canada;;16.apr.20
Sentry (sentry.io);Senior Engineering Manager, Product;https://www.python.org/jobs/4520/;Toronto, Canada;;16.apr.20
Hyperfine Research, Inc.;Software Engineer for Scalable Systems;https://www.python.org/jobs/4519/;Guilford, Connecticut, United States of America;Back end, Image Processing, Integration, Machine Learning, Numeric processing, Operations, Systems, Linux (Ubuntu) Docker Git C/C++ and JS are a plus;16.apr.20
Cockroach Labs;Software Engineer, Backend (NYC, SF, Seattle, Toronto);https://www.python.org/jobs/4518/;New York, NY, United States;Back end, Database;16.apr.20
Cockroach Labs;Site Reliability Engineer;https://www.python.org/jobs/4517/;New York, New York, United States;Back end, Database, Front end, Operations, Systems;16.apr.20
Cockroach Labs;Developer Advocate;https://www.python.org/jobs/4516/;New York, New York, United States;Back end, Cloud, Database, Evangelism, Front end, Operations;16.apr.20
Stylight GmbH;Senior Python Engineer (d/f/m);https://www.python.org/jobs/4514/;Munich, Germany;;15.apr.20
Hudson River Trading LLC;Post Trade Developer - Chicago;https://www.python.org/jobs/4513/;Chicago, IL, United States;;14.apr.20
Hudson River Trading LLC;Post Trade Developer  - NYC;https://www.python.org/jobs/4512/;New York, NY, United States;;14.apr.20
Hudson River Trading LLC;Systems Engineer (Trading) - London;https://www.python.org/jobs/4511/;London, United Kingdom;;14.apr.20
Hudson River Trading LLC;Systems Engineer (Trading) - NYC;https://www.python.org/jobs/4510/;New York, NY, United States;;14.apr.20
Hudson River Trading LLC;Debian Systems Engineer;https://www.python.org/jobs/4509/;New York, NY, United States;;14.apr.20
Hudson River Trading LLC;TradeOps Developer - Singapore (Python);https://www.python.org/jobs/4508/;Singapore, Singapore;;14.apr.20
Hudson River Trading LLC;TradeOps Developer - NYC (Python);https://www.python.org/jobs/4507/;New York, NY, United States;;14.apr.20
Hudson River Trading LLC;Quantitative Software Engineer (Python);https://www.python.org/jobs/4506/;New York, NY, United States;;14.apr.20
Hudson River Trading LLC;Algo Software Engineer (C++/Python);https://www.python.org/jobs/4505/;New York, NY, United States;;14.apr.20
Novetta;Systems Engineer;https://www.python.org/jobs/4504/;Annapolis Junction, MD, USA;;14.apr.20
Novetta;Software Engineer;https://www.python.org/jobs/4503/;Annapolis Junction, MD, USA;;14.apr.20
Novetta;Digital Network Exploitation Analyst;https://www.python.org/jobs/4502/;Annapolis Junction, MD, USA;;14.apr.20
Novetta;CNO Analyst/Programer III;https://www.python.org/jobs/4501/;Annapolis Junction, MD, USA;;14.apr.20
Novetta;CNO Analyst/Programmer II;https://www.python.org/jobs/4500/;Annapolis Junction, MD, USA;;14.apr.20
Novetta;CNO Developer, Jr.;https://www.python.org/jobs/4499/;McLean, VA, USA;Big Data;14.apr.20
Novetta;Test Engineer;https://www.python.org/jobs/4498/;Fort Bragg, NC, USA;Big Data;14.apr.20
Novetta;Full Stack Developer, Python & Cloud;https://www.python.org/jobs/4497/;McLean, VA, USA;Big Data, Cloud;14.apr.20
Novetta;Python Developer;https://www.python.org/jobs/4496/;Springfield, VA, USA;Big Data;14.apr.20
Novetta;Network Analyst;https://www.python.org/jobs/4495/;Annapolis Junction, MD, USA;Big Data;14.apr.20
Novetta;Computer Scientist;https://www.python.org/jobs/4494/;Annapolis Junction, MD, USA;Big Data, Machine Learning;14.apr.20
Novetta;Data Scientist;https://www.python.org/jobs/4493/;Annapolis Junction, MD, USA;Big Data, Machine Learning;14.apr.20
Core Tech;Senior Full Stack Python Developer;https://www.python.org/jobs/4492/;London, Mayfair, United Kingdom;Back end, Big Data, Cloud, Front end, Machine Learning, Testing, Web, Django React Docker Microservices Numpy Pandas Tensorflow;11.apr.20
Facebook;Manager, Software Engineering;https://www.python.org/jobs/4491/;New York, NY, United States;Back end, Big Data, Database, Finance, Front end, Image Processing, Integration, Lead, Machine Learning, Management, Numeric processing, Operations, Systems, Testing, Text Processing, Web, Python;10.apr.20
Facebook;Software Engineer, Infrastructure;https://www.python.org/jobs/4490/;Menlo Park, California, United States;Back end, Big Data, Cloud, Database, Front end, Image Processing, Integration, Lead, Machine Learning, Management, Numeric processing, Operations, Systems, Testing, Text Processing, Web, Python;10.apr.20
Facebook;Production Engineer;https://www.python.org/jobs/4489/;Menlo Park, California, United States;Back end, Big Data, Front end, Machine Learning, Management, Systems, Testing, Web, Python;10.apr.20
Microsoft;Senior Program Manager;https://www.python.org/jobs/4488/;Redmond, WA, USA;;7.apr.20
Anyscale;Software Engineer (Frontend);https://www.python.org/jobs/4487/;Berkeley, CA, United States;Cloud, Front end, Machine Learning;7.apr.20
Anyscale;Software Engineer (Machine Learning);https://www.python.org/jobs/4486/;Berkeley, CA, United States;Back end, Cloud, Machine Learning;7.apr.20
Anyscale;Software Engineer;https://www.python.org/jobs/4485/;Berkeley, CA, United States;Back end, Cloud, Machine Learning;7.apr.20
Bloomberg LP;Senior Software Engineer (C++, Python, SQL) – Enterprise Product Workflows;https://www.python.org/jobs/4481/;New York, New York, United States of America;;2.apr.20
Bloomberg LP;Senior Software Engineer (Python/Go) for Enterprise Connectivity;https://www.python.org/jobs/4480/;New York, New York, United States of America;;2.apr.20
Bloomberg LP;Senior Software Engineer - Enterprise Data License;https://www.python.org/jobs/4479/;New York, New York, United States of America;Back end, Big Data;2.apr.20
Neuron soundware;SW Lead (Python);https://www.python.org/jobs/4478/;Prague, Czech Republic;Back end, Cloud, Database, Front end, Lead, Python;2.apr.20
Scrapinghub;DevOps Engineer - Remote;https://www.python.org/jobs/4475/;Remote, Remote, Remote;Big Data, Cloud, Operations, Systems, Web, Python Linux Kafka Docker Mesos Kubernetes;26 March 2020
Flowe Spa- Gruppo Mediolanum;Software/ Data Engineer;https://www.python.org/jobs/4471/;Milano 3, Basiglio (MI), Italy, Milan, Italy;Database, Machine Learning, Python;
Gorgias;Full-Stack Python/JS engineer;https://www.python.org/jobs/4470/;San Franciso, California, USA, and, Paris, Île-de-France, France;Back end, Web, Python JavaScript Flask (REST API) Celery PostgreSQL RabbitMQ Redis React;19 March 2020
High Tech Genesis;Python Developer;https://www.python.org/jobs/4468/;Kanata, ON, Canada;Back end;19 March 2020
High Tech Genesis;Senior Python Software Developer;https://www.python.org/jobs/4467/;Montreal, QC, Canada;Back end;19 March 2020
